{
  "schemaVersion": "1",
  "mode": "curated",
  "generatedAt": "2026-06-08T09:30:00Z",
  "summary": "The current durable profile favors Python/Rust, while older Java/Spring Boot references are project-scoped or stale.",
  "currentClaims": [
    {
      "id": "claim-user-primary-stack",
      "subject": "user",
      "field": "primary_stack",
      "value": "Python/Rust",
      "scope": "global",
      "status": "current",
      "confidence": 0.92,
      "rationale": "The latest correction note names Python/Rust as the user's primary stack.",
      "evidence": [
        {
          "sourcePath": "extensions/ad_hoc/notes/20260608-103659-profile-stack-update.md",
          "startLine": 1,
          "endLine": 3,
          "summary": "The user's primary technical stack has shifted to Python/Rust."
        }
      ]
    }
  ],
  "staleClaims": [
    {
      "id": "claim-old-user-stack",
      "subject": "user",
      "field": "primary_stack",
      "value": "Java/Spring Boot",
      "scope": "global",
      "status": "stale",
      "confidence": 0.78,
      "rationale": "Older memory conflicts with the latest correction note.",
      "evidence": [
        {
          "sourcePath": "memory_summary.md",
          "startLine": 20,
          "endLine": 24,
          "summary": "Older profile text mentions Java/Spring Boot."
        }
      ]
    }
  ],
  "conflicts": [
    {
      "id": "conflict-primary-stack",
      "title": "Primary stack mismatch",
      "detail": "Older Java/Spring Boot profile text conflicts with the newer Python/Rust correction.",
      "confidence": 0.84,
      "claimIds": ["claim-user-primary-stack", "claim-old-user-stack"],
      "evidence": [
        {
          "sourcePath": "memory_summary.md",
          "startLine": 20,
          "endLine": 24,
          "summary": "Older profile text mentions Java/Spring Boot."
        },
        {
          "sourcePath": "extensions/ad_hoc/notes/20260608-103659-profile-stack-update.md",
          "startLine": 1,
          "endLine": 3,
          "summary": "The user's primary technical stack has shifted to Python/Rust."
        }
      ]
    }
  ],
  "uncertainClaims": [
    {
      "id": "claim-beebotos-current",
      "subject": "project:beebotos",
      "field": "activity",
      "value": "active",
      "scope": "project",
      "status": "uncertain",
      "confidence": 0.55,
      "rationale": "Recent activity evidence exists, but durable project status needs confirmation.",
      "evidence": [
        {
          "sourcePath": "extensions/chronicle/resources/2026-06-04T08-01-00-gPye-10min-memory-summary.md",
          "startLine": 1,
          "endLine": 20,
          "summary": "Chronicle activity shows BeeBotOS work."
        }
      ]
    }
  ],
  "suggestedCorrections": [
    {
      "id": "correction-primary-stack",
      "title": "Clarify current primary stack",
      "reason": "Older global profile text may still imply Java/Spring Boot.",
      "content": "Memory update request:\n\n- The user's current primary technical stack is Python/Rust, not Java/Spring Boot.\n- Treat Java/Spring Boot references as project-specific unless newer evidence says otherwise.\n",
      "confidence": 0.81,
      "affectedClaimIds": ["claim-user-primary-stack", "claim-old-user-stack"],
      "evidence": [
        {
          "sourcePath": "extensions/ad_hoc/notes/20260608-103659-profile-stack-update.md",
          "startLine": 1,
          "endLine": 3,
          "summary": "The user's primary technical stack has shifted to Python/Rust."
        }
      ]
    }
  ],
  "metadata": {
    "memoryRoot": "/Users/qsh/.codex/memories",
    "inputEntries": 42,
    "model": "codex-exec-fixture"
  }
}
